{"schemaVersion":"1.1.0","auditSchemaMajor":1,"direction":"reference-to-target","reference":{"schemaVersion":"1.0.0","generatedAt":"2026-09-24T12:00:00+00:00","audit":{"mode":"read-only","toolVersion":"0.8.0"},"host":{"name":"SYNTHETIC-REFERENCE","platform":"windows","architecture":"x64"}},"target":{"schemaVersion":"1.0.0","generatedAt":"2026-09-24T12:00:00+00:00","audit":{"mode":"read-only","toolVersion":"0.8.0"},"host":{"name":"SYNTHETIC-TARGET","platform":"windows","architecture":"x64"}},"summary":{"status":"different","differenceCount":8,"providerDifferenceCount":1,"componentDifferenceCount":1,"versionDifferenceCount":1,"unavailableCount":1,"unknownCount":1,"notApplicableCount":1},"differences":[{"category":"provider","kind":"status","providerId":"synthetic.optional","componentId":null,"subjectId":null,"relation":"not-applicable","referenceState":"not-applicable","targetState":"success","referenceValue":null,"targetValue":null},{"category":"component","kind":"state","providerId":"runtime.synthetic","componentId":"tool","subjectId":null,"relation":"different","referenceState":"present","targetState":"partial","referenceValue":null,"targetValue":null},{"category":"version","kind":"active-version","providerId":"runtime.synthetic","componentId":"tool","subjectId":null,"relation":"different","referenceState":null,"targetState":null,"referenceValue":{"raw":"1.0.0","normalized":"1.0.0","channel":"stable"},"targetValue":{"raw":"2.0.0","normalized":"2.0.0","channel":"stable"}},{"category":"path","kind":"scope-order","providerId":"path.environment","componentId":null,"subjectId":"machine","relation":"unknown","referenceState":"unknown","targetState":"present","referenceValue":null,"targetValue":["c:/tools","c:/sdk"]},{"category":"environment","kind":"allowlisted-variable","providerId":"path.environment","componentId":null,"subjectId":"java_home","relation":"different","referenceState":null,"targetState":null,"referenceValue":"c:/java17","targetValue":"c:/java21"},{"category":"application","kind":"presence","providerId":"winget.baseline","componentId":null,"subjectId":"Vendor.App","relation":"reference-only","referenceState":"present","targetState":"missing","referenceValue":{"packageId":"Vendor.App"},"targetValue":null},{"category":"project","kind":"runtime-constraints","providerId":"projects.local","componentId":null,"subjectId":"project:alpha","relation":"different","referenceState":null,"targetState":null,"referenceValue":[{"ecosystem":"node","source":"package.json#engines.node","value":">=20"}],"targetValue":[{"ecosystem":"node","source":"package.json#engines.node","value":">=22"}]},{"category":"git","kind":"inspection-state","providerId":"git.repository-health","componentId":null,"subjectId":"git-repository:alpha","relation":"unavailable","referenceState":"inspected","targetState":"unavailable","referenceValue":null,"targetValue":null}]}
